{
  "$schema": "https://json-schema.org/draft/2020-12/schema",
  "$id": "https://40kdc.dev/schemas/core/unit.schema.json",
  "title": "Unit",
  "description": "A unit datasheet entry with stat profiles and point costs.",
  "type": "object",
  "properties": {
    "id": { "$ref": "../defs/common.schema.json#/$defs/entity-id" },
    "external_refs": {
      "$ref": "../defs/common.schema.json#/$defs/external-reference-list"
    },
    "name": { "type": "string", "minLength": 1, "maxLength": 128 },
    "aliases": {
      "type": "array",
      "items": { "type": "string", "minLength": 1 },
      "description": "Alternate names this unit is known by (e.g. spelling variants in other tools' roster exports). Consulted by name lookup so an import matches despite a spelling difference; never displayed."
    },
    "faction_id": { "$ref": "../defs/common.schema.json#/$defs/entity-id" },
    "role": {
      "type": "string",
      "enum": [
        "character",
        "battleline",
        "dedicated-transport",
        "fortification",
        "allied",
        "epic-hero"
      ],
      "description": "Battlefield role from the datasheet header. Unit types (Infantry, Vehicle, etc.) belong in keywords."
    },
    "attachment_role": {
      "oneOf": [{ "enum": ["leader", "support"] }, { "type": "null" }],
      "description": "Character attachment role (11e). 'support' implies the unit is only legal when attached to a host unit (cannot be taken solo); 'leader' is valid as a standalone list entry. null/absent for non-attaching units."
    },
    "profiles": {
      "type": "array",
      "items": {
        "type": "object",
        "properties": {
          "name": {
            "type": "string",
            "description": "Profile name (e.g., 'Wounded' for degrading)"
          },
          "M": { "$ref": "../defs/common.schema.json#/$defs/stat-value" },
          "T": { "type": "integer", "minimum": 1 },
          "W": { "type": "integer", "minimum": 1 },
          "Sv": { "type": "integer", "minimum": 2, "maximum": 7 },
          "invuln_sv": {
            "oneOf": [
              { "type": "integer", "minimum": 2, "maximum": 6 },
              { "type": "null" }
            ]
          },
          "invuln_sv_ranged": {
            "description": "Attack-scoped invulnerable save that applies only to ranged attacks.",
            "oneOf": [
              { "type": "integer", "minimum": 2, "maximum": 6 },
              { "type": "null" }
            ]
          },
          "invuln_sv_melee": {
            "description": "Attack-scoped invulnerable save that applies only to melee attacks.",
            "oneOf": [
              { "type": "integer", "minimum": 2, "maximum": 6 },
              { "type": "null" }
            ]
          },
          "Ld": { "type": "integer", "minimum": 2, "maximum": 10 },
          "OC": { "type": "integer", "minimum": 0 }
        },
        "required": ["M", "T", "W", "Sv", "Ld", "OC"]
      },
      "minItems": 1
    },
    "points": {
      "type": "array",
      "items": {
        "type": "object",
        "properties": {
          "models": {
            "type": "integer",
            "minimum": 1,
            "description": "Lowest model count this tier's cost applies to. For a single-size tier this is the only size; for a GW range-priced tier (block pricing) it is the range floor and `models_max` is the ceiling. `baseUnitPoints` prices a squad at the highest `models` threshold its count reaches."
          },
          "cost": { "type": "integer", "minimum": 0 },
          "models_max": {
            "type": "integer",
            "minimum": 1,
            "description": "Inclusive upper model count for a range-priced tier (GW block pricing, e.g. Venatari Custodians are 4–6 models for 320). `models` is the range floor; every size in [models, models_max] costs `cost`. Absent when the tier prices a single size (equivalent to models_max == models)."
          },
          "unit_count_min": {
            "type": "integer",
            "minimum": 1,
            "description": "11e per-army-ordinal pricing: the first army-copy count (1-based) this tier's cost applies to. Absent (together with unit_count_max) means the cost applies to every copy — the common case. Present only for datasheets the MFM prices by how many you have taken (e.g. 'your 1st-2nd units cost X, your 3rd+ unit costs Y')."
          },
          "unit_count_max": {
            "oneOf": [{ "type": "integer", "minimum": 1 }, { "type": "null" }],
            "description": "Inclusive upper army-copy count for this tier's band, or null for an open-ended top band ('3rd+ unit'). Absent when unit_count_min is absent."
          }
        },
        "required": ["models", "cost"]
      }
    },
    "allied_points": {
      "type": "array",
      "description": "11e: alternate point costs that apply only when this unit is included in a host army of another faction (e.g. an Agents of the Imperium unit allied into any IMPERIUM army). Each entry mirrors a `points` tier but is scoped to a `host_faction`. Absent for the common case where the unit costs the same everywhere; consumers that don't model allied pricing read `points` (the native cost) and ignore this.",
      "items": {
        "type": "object",
        "properties": {
          "host_faction": {
            "$ref": "../defs/common.schema.json#/$defs/entity-id",
            "description": "The host-army faction/super-faction keyword this cost applies under (e.g. `imperium`)."
          },
          "models": { "type": "integer", "minimum": 1 },
          "cost": { "type": "integer", "minimum": 0 },
          "models_max": { "type": "integer", "minimum": 1 },
          "unit_count_min": { "type": "integer", "minimum": 1 },
          "unit_count_max": {
            "oneOf": [{ "type": "integer", "minimum": 1 }, { "type": "null" }]
          }
        },
        "required": ["host_faction", "models", "cost"],
        "additionalProperties": false
      }
    },
    "points_provisional": {
      "type": "boolean",
      "default": false,
      "description": "True when point costs are carried over provisionally (e.g. seeded from a prior edition during migration) and not yet confirmed against the current dataslate."
    },
    "wargear_costs": {
      "type": "array",
      "description": "Per-item MFM wargear prices that the option-level `additional_cost` on wargear-option records cannot express: priced default-loadout items (e.g. a Terminator Assault Squad's thunder hammers, which are the default with only a swap-away option to hang a cost on) and heterogeneous choice groups where only some items in a group cost points. Each entry charges `cost` points for every copy of `item_id` in the unit's FINAL loadout (defaults included). Additive and optional — a consumer that ignores it prices this wargear as free, exactly as before. Sourced authoritatively from the MFM dump (`wargear_option.points`).",
      "items": {
        "type": "object",
        "properties": {
          "item_id": {
            "$ref": "../defs/common.schema.json#/$defs/entity-id",
            "description": "The weapon or wargear id this per-copy cost applies to, matched against the unit's final loadout."
          },
          "cost": {
            "type": "integer",
            "minimum": 0,
            "description": "Points charged per copy of `item_id` present in the final loadout."
          }
        },
        "required": ["item_id", "cost"],
        "additionalProperties": false
      }
    },
    "keywords": { "$ref": "../defs/common.schema.json#/$defs/keyword-list" },
    "faction_keywords": {
      "$ref": "../defs/common.schema.json#/$defs/keyword-list"
    },
    "conditional_keywords": {
      "type": "array",
      "description": "Keywords granted to this unit only when roster construction satisfies the source condition. Conditions are conjunctive within an entry; entries are independent grants.",
      "items": {
        "type": "object",
        "properties": {
          "keyword": { "$ref": "../defs/common.schema.json#/$defs/keyword" },
          "required_detachment_id": {
            "oneOf": [
              { "$ref": "../defs/common.schema.json#/$defs/entity-id" },
              { "type": "null" }
            ]
          },
          "required_faction_keyword": {
            "oneOf": [
              { "$ref": "../defs/common.schema.json#/$defs/keyword" },
              { "type": "null" }
            ]
          }
        },
        "required": ["keyword"],
        "additionalProperties": false
      }
    },
    "excluded_faction_keywords": {
      "description": "Faction keywords whose armies are barred from taking this otherwise-generic unit. Used where the game removes a generic unit from a specific sub-faction without printing a replacement (e.g. Black Templars cannot field Librarians; Deathwatch cannot field the generic Tactical Squad). An army may take this unit only if none of its faction keywords appear here. Absent/empty = available to every keyword-eligible army. Distinct from `faction_keywords`, which is the positive access list; this is the negative one for the rare exclusions a flat shared pool cannot otherwise express.",
      "oneOf": [
        { "$ref": "../defs/common.schema.json#/$defs/keyword-list" },
        { "type": "null" }
      ]
    },
    "base_size_mm": {
      "description": "The unit's representative base (the most-numerous model's base). Mixed-model units carry the full per-model breakdown in unit-composition; this top-level value is a convenience for consumers that need a single base.",
      "oneOf": [
        { "$ref": "../defs/common.schema.json#/$defs/base-size" },
        { "type": "null" }
      ]
    },
    "model_count": {
      "type": "object",
      "properties": {
        "min": { "type": "integer", "minimum": 1 },
        "max": { "type": "integer", "minimum": 1 }
      },
      "required": ["min", "max"]
    },
    "weapon_ids": {
      "type": "array",
      "items": { "$ref": "../defs/common.schema.json#/$defs/entity-id" }
    },
    "ability_ids": {
      "type": "array",
      "description": "The abilities the unit's datasheet prints: an ability id, or an object for a rated rule ({id, value}: Deadly Demise D3, Feel No Pain 5+, Scouts 9\", Firing Deck 2, whose record reads the value through {rating: true}) or for the ability a wargear item prints ({id, wargear}: the unit's default wargear that carries it).",
      "items": {
        "oneOf": [
          { "$ref": "../defs/common.schema.json#/$defs/entity-id" },
          {
            "title": "Unit ability ref",
            "type": "object",
            "additionalProperties": false,
            "required": ["id"],
            "anyOf": [{ "required": ["value"] }, { "required": ["wargear"] }],
            "properties": {
              "id": { "$ref": "../defs/common.schema.json#/$defs/entity-id" },
              "value": { "$ref": "../defs/common.schema.json#/$defs/stat-value" },
              "wargear": { "$ref": "../defs/common.schema.json#/$defs/entity-id", "description": "The wargear item (a weapons.json or wargear.json id) that prints this ability." }
            }
          }
        ]
      }
    },
    "wargear_budgets": {
      "type": "array",
      "description": "Limited-wargear squad allowances the per-weapon bounds cannot express: a GW `limited_wargear_choice_set` that is either (a) SHARED across several weapons (a 'for every N models, one model can take one of A/B/C' line) or (b) a FLAT per-unit cap ('up to 1 per unit'). A loadout is legal only if the summed count of a budget's items is at most the cap: `floor(model_count * count / per_models)` for a ratio, or just `count` when `per_models` is 0 (a flat per-unit cap). Single-weapon per-N allowances are NOT budgets — the per-weapon bounds already model them (they correctly sum a weapon's capacity across the model types that may take it).",
      "items": {
        "type": "object",
        "properties": {
          "items": {
            "type": "array",
            "items": { "$ref": "../defs/common.schema.json#/$defs/entity-id" },
            "minItems": 1
          },
          "count": { "type": "integer", "minimum": 1 },
          "per_models": {
            "type": "integer",
            "minimum": 0,
            "description": "Models per `count` allowance; 0 means a flat per-unit cap of `count` (independent of squad size)."
          },
          "duplicate_limit": {
            "type": "integer",
            "minimum": 1,
            "description": "Optional per-item sub-cap: at most this many copies of any SINGLE item in the set — `floor(model_count * duplicate_limit / per_models)` for a ratio, or `duplicate_limit` when `per_models` is 0. Absent means the shared `count` cap is the only bound (any one item may fill the whole allowance)."
          }
        },
        "required": ["items", "count", "per_models"],
        "additionalProperties": false
      }
    },
    "transport_capacity": {
      "oneOf": [
        {
          "type": "object",
          "properties": {
            "capacity": { "type": "integer", "minimum": 1 },
            "keyword_restrictions": {
              "oneOf": [
                { "$ref": "../defs/common.schema.json#/$defs/keyword-list" },
                { "type": "null" }
              ]
            },
            "exclusion_keywords": {
              "oneOf": [
                { "$ref": "../defs/common.schema.json#/$defs/keyword-list" },
                { "type": "null" }
              ]
            }
          },
          "required": ["capacity"],
          "additionalProperties": false
        },
        { "type": "null" }
      ]
    },
    "game_version": { "$ref": "../defs/game-version-ref.schema.json" },
    "is_legend": { "type": "boolean", "default": false },
    "game_modes": {
      "$ref": "../defs/common.schema.json#/$defs/game-modes",
      "description": "Game modes this unit is legal or authored for; absent implies matched-play."
    }
  },
  "required": ["id", "name", "faction_id", "profiles", "game_version"],
  "additionalProperties": false
}
