[
  {
    "id": "trygon",
    "name": "Trygon",
    "faction_id": "tyranids",
    "profiles": [
      {
        "name": "Trygon",
        "M": 10,
        "T": 10,
        "W": 14,
        "Sv": 3,
        "invuln_sv": null,
        "Ld": 8,
        "OC": 4
      }
    ],
    "points": [
      {
        "models": 1,
        "cost": 135
      }
    ],
    "keywords": [
      "Monster",
      "Great Devourer",
      "Vanguard Invader",
      "Trygon"
    ],
    "faction_keywords": [
      "Tyranids"
    ],
    "base_size_mm": {
      "shape": "oval",
      "width": 120,
      "length": 92
    },
    "model_count": {
      "min": 1,
      "max": 1
    },
    "weapon_ids": [
      "bio-electric-pulse",
      "trygon-scything-talons"
    ],
    "ability_ids": [
      "deep-strike",
      "subterranean-tunnels-tyranids",
      {
        "id": "damaged",
        "value": 5
      }
    ],
    "game_version": {
      "edition": "11th",
      "dataslate": "mfm-995"
    },
    "is_legend": false,
    "points_provisional": false,
    "conditional_keywords": [
      {
        "keyword": "Burrower",
        "required_detachment_id": "subterranean-assault"
      }
    ],
    "external_refs": [
      {
        "namespace": "bsdata",
        "id": "56db-d7c-b349-677f"
      },
      {
        "namespace": "game-datacards",
        "id": "6c4e1665-c826-50e4-8db9-304ca1d6fb74"
      },
      {
        "namespace": "mfm",
        "id": "845791ff-0ab3-44a2-a24d-c2e8ceea9479"
      }
    ]
  },
  {
    "id": "mawloc",
    "name": "Mawloc",
    "faction_id": "tyranids",
    "profiles": [
      {
        "name": "Mawloc",
        "M": 10,
        "T": 10,
        "W": 14,
        "Sv": 3,
        "invuln_sv": null,
        "Ld": 8,
        "OC": 4
      }
    ],
    "points": [
      {
        "models": 1,
        "cost": 130
      }
    ],
    "keywords": [
      "Monster",
      "Great Devourer",
      "Vanguard Invader",
      "Mawloc"
    ],
    "faction_keywords": [
      "Tyranids"
    ],
    "base_size_mm": {
      "shape": "oval",
      "width": 120,
      "length": 92
    },
    "model_count": {
      "min": 1,
      "max": 1
    },
    "weapon_ids": [
      "distensible-jaw",
      "mawloc-scything-talons"
    ],
    "ability_ids": [
      "terror-from-the-deep-tyranids",
      "deep-strike",
      {
        "id": "damaged",
        "value": 5
      }
    ],
    "game_version": {
      "edition": "11th",
      "dataslate": "mfm-995"
    },
    "is_legend": false,
    "points_provisional": false,
    "conditional_keywords": [
      {
        "keyword": "Burrower",
        "required_detachment_id": "subterranean-assault"
      }
    ],
    "external_refs": [
      {
        "namespace": "bsdata",
        "id": "2bbb-d811-15f7-1a81"
      },
      {
        "namespace": "game-datacards",
        "id": "22c5eef9-80de-594a-be01-19174a72b2a9"
      },
      {
        "namespace": "mfm",
        "id": "962aa559-1cdb-4e7d-8476-7e9c5ab17a94"
      }
    ]
  },
  {
    "id": "tyranid-warriors-with-ranged-bio-weapons",
    "name": "Tyranid Warriors with Ranged Bio-weapons",
    "faction_id": "tyranids",
    "profiles": [
      {
        "name": "Tyranid Warrior",
        "M": 6,
        "T": 5,
        "W": 3,
        "Sv": 4,
        "invuln_sv": null,
        "Ld": 7,
        "OC": 2
      }
    ],
    "points": [
      {
        "models": 3,
        "cost": 60
      },
      {
        "models": 4,
        "models_max": 6,
        "cost": 120
      }
    ],
    "keywords": [
      "Infantry",
      "Great Devourer",
      "Synapse",
      "Tyranid Warriors with Ranged Bio-Weapons"
    ],
    "faction_keywords": [
      "Tyranids"
    ],
    "base_size_mm": {
      "shape": "round",
      "diameter": 50
    },
    "model_count": {
      "min": 3,
      "max": 6
    },
    "weapon_ids": [
      "barbed-strangler",
      "deathspitter",
      "devourer",
      "spinefists",
      "tyranid-warrior-claws-and-talons",
      "venom-cannon"
    ],
    "ability_ids": [
      "adaptable-predators-tyranids"
    ],
    "game_version": {
      "edition": "11th",
      "dataslate": "mfm-995"
    },
    "is_legend": false,
    "points_provisional": false,
    "wargear_budgets": [
      {
        "items": [
          "barbed-strangler"
        ],
        "count": 2,
        "per_models": 6
      },
      {
        "items": [
          "venom-cannon"
        ],
        "count": 2,
        "per_models": 6
      }
    ],
    "conditional_keywords": [
      {
        "keyword": "Battleline",
        "required_detachment_id": "warrior-bioform-onslaught"
      }
    ],
    "external_refs": [
      {
        "namespace": "bsdata",
        "id": "a125-b6fb-2945-56a"
      },
      {
        "namespace": "game-datacards",
        "id": "7c0e60dd-c71a-55fd-8ff3-f9e862fa2f5e"
      },
      {
        "namespace": "mfm",
        "id": "33f75ed2-c401-4f39-99d6-a1328384a6da"
      }
    ]
  },
  {
    "id": "winged-hive-tyrant",
    "name": "Winged Hive Tyrant",
    "faction_id": "tyranids",
    "role": "character",
    "profiles": [
      {
        "name": "Winged Hive Tyrant",
        "M": 12,
        "T": 9,
        "W": 10,
        "Sv": 2,
        "invuln_sv": 4,
        "Ld": 7,
        "OC": 3
      }
    ],
    "points": [
      {
        "models": 1,
        "cost": 185
      }
    ],
    "keywords": [
      "Monster",
      "Character",
      "Psyker",
      "Fly",
      "Great Devourer",
      "Synapse",
      "Vanguard Invader",
      "Hive Tyrant",
      "Winged Hive Tyrant"
    ],
    "faction_keywords": [
      "Tyranids"
    ],
    "base_size_mm": {
      "shape": "round",
      "diameter": 60
    },
    "model_count": {
      "min": 1,
      "max": 1
    },
    "weapon_ids": [
      "heavy-venom-cannon",
      "monstrous-bonesword-and-lash-whip",
      "monstrous-scything-talons",
      "stranglethorn-cannon",
      "tyrant-talons"
    ],
    "ability_ids": [
      {
        "id": "deadly-demise",
        "value": "D3"
      },
      "paroxysm-tyranids",
      "will-of-the-hive-mind-tyranids",
      "deep-strike"
    ],
    "game_version": {
      "edition": "11th",
      "dataslate": "mfm-995"
    },
    "is_legend": false,
    "points_provisional": false,
    "external_refs": [
      {
        "namespace": "bsdata",
        "id": "fa68-fcb9-38c-cd0f"
      },
      {
        "namespace": "game-datacards",
        "id": "0d7e8129-da97-5e33-80e4-012f62c438c7"
      },
      {
        "namespace": "mfm",
        "id": "feeb4379-7289-4baa-a1f9-88de108bb5bd"
      }
    ]
  },
  {
    "id": "harridan",
    "name": "Harridan",
    "faction_id": "tyranids",
    "profiles": [
      {
        "name": "Harridan",
        "M": 20,
        "T": 10,
        "W": 30,
        "Sv": 3,
        "invuln_sv": null,
        "Ld": 8,
        "OC": 0
      }
    ],
    "points": [
      {
        "models": 1,
        "cost": 610,
        "unit_count_min": 1,
        "unit_count_max": 1
      },
      {
        "models": 1,
        "cost": 660,
        "unit_count_min": 2,
        "unit_count_max": null
      }
    ],
    "keywords": [
      "Monster",
      "Titanic",
      "Fly",
      "Aircraft",
      "Transport",
      "Great Devourer",
      "Harridan"
    ],
    "faction_keywords": [
      "Tyranids"
    ],
    "base_size_mm": {
      "shape": "unique",
      "draft": true
    },
    "model_count": {
      "min": 1,
      "max": 1
    },
    "weapon_ids": [
      "dire-bio-cannon",
      "gargantuan-scything-talons"
    ],
    "ability_ids": [
      {
        "id": "deadly-demise",
        "value": "2D6"
      },
      "frenzied-metabolism-tyranids",
      "hover",
      {
        "id": "damaged",
        "value": 10
      }
    ],
    "transport_capacity": {
      "capacity": 20
    },
    "game_version": {
      "edition": "11th",
      "dataslate": "mfm-995"
    },
    "is_legend": false,
    "points_provisional": false,
    "external_refs": [
      {
        "namespace": "bsdata",
        "id": "9b5c-3b5a-1f80-9a74"
      },
      {
        "namespace": "game-datacards",
        "id": "566eaac5-daad-5c8e-833d-a8c69749d04c"
      },
      {
        "namespace": "mfm",
        "id": "bce9d40d-c8f6-441b-9181-349c81aae55d"
      }
    ]
  },
  {
    "id": "norn-emissary",
    "name": "Norn Emissary",
    "faction_id": "tyranids",
    "profiles": [
      {
        "name": "Norn Emissary",
        "M": 10,
        "T": 11,
        "W": 16,
        "Sv": 2,
        "invuln_sv": 4,
        "Ld": 7,
        "OC": 5
      }
    ],
    "points": [
      {
        "models": 1,
        "cost": 250,
        "unit_count_min": 1,
        "unit_count_max": 1
      },
      {
        "models": 1,
        "cost": 270,
        "unit_count_min": 2,
        "unit_count_max": null
      }
    ],
    "keywords": [
      "Monster",
      "Psyker",
      "Great Devourer",
      "Synapse",
      "Norn Emissary"
    ],
    "faction_keywords": [
      "Tyranids"
    ],
    "base_size_mm": {
      "shape": "round",
      "diameter": 100
    },
    "model_count": {
      "min": 1,
      "max": 1
    },
    "weapon_ids": [
      "monstrous-rending-claws",
      "monstrous-scything-talons-norn-emissary",
      "psychic-tendril"
    ],
    "ability_ids": [
      {
        "id": "deadly-demise",
        "value": "D6"
      },
      "singular-purpose-tyranids",
      "unnatural-resilience-tyranids",
      {
        "id": "damaged",
        "value": 5
      }
    ],
    "game_version": {
      "edition": "11th",
      "dataslate": "mfm-995"
    },
    "is_legend": false,
    "points_provisional": false,
    "external_refs": [
      {
        "namespace": "bsdata",
        "id": "5720-2873-8c2c-edc3"
      },
      {
        "namespace": "game-datacards",
        "id": "895a59c0-f445-5d73-81ba-439ff8831a27"
      },
      {
        "namespace": "mfm",
        "id": "3516ca8e-d0bb-436e-a5c8-01b856025373"
      }
    ]
  },
  {
    "id": "winged-tyranid-prime",